{
  "artifact_type": "semantic-composition",
  "artifact_version": "2",
  "artifact_id": "composition:kosten-des-abwartens",
  "normalized_brief_ref": {
    "artifact_id": "normalized:kosten-des-abwartens",
    "artifact_version": "1",
    "content_fingerprint": "sha256:f0bc3dcd110b67d544b84ecb8ab6f7fce47df7d3a0a554fa06b83f79cde522d0"
  },
  "pattern_library_ref": {
    "artifact_id": "cogni-publishing/pattern-library",
    "artifact_version": "1"
  },
  "design_system": {
    "name": "cogni-work",
    "version": "1.0.0"
  },
  "targets": [
    "html",
    "pptx"
  ],
  "units": [
    {
      "id": "u-antwort",
      "role": "governing-thought",
      "pattern": "answer-emphasis",
      "variant": "statement-with-support",
      "bindings": [
        {
          "slot": "answer",
          "record_ref": "antwort",
          "field": "title",
          "digest": "sha256:68bd44847f48be04cf237ace2db846cfdcd73c171044d6accf76801721833fff"
        },
        {
          "slot": "support",
          "record_ref": "antwort",
          "field": "body",
          "digest": "sha256:8bef264d369944e64b3715164cb6f15ba1639b0a27421be55b74e0ccbb4aa091"
        },
        {
          "slot": "notes",
          "record_ref": "antwort",
          "field": "notes",
          "digest": "sha256:eb2c2ca6bd1953bfdda0d00fb70dbd5d0125bbab9a622afebc8da0e0112af120"
        }
      ],
      "source_refs": [
        "fraunhofer-2025"
      ]
    },
    {
      "id": "u-vergleich",
      "role": "shift",
      "pattern": "comparison",
      "variant": "tabular",
      "bindings": [
        {
          "slot": "items",
          "record_ref": "heute",
          "field": "title",
          "digest": "sha256:5168acb4c00ac4e74370aa3282a1a044dff27490ad5a54b2efd83712a93d513b"
        },
        {
          "slot": "items",
          "record_ref": "heute",
          "field": "body",
          "digest": "sha256:d43e49bfd79ef7984976187193c817a6e70fc4e2d1e7d0142b3d72aefac00514"
        },
        {
          "slot": "items",
          "record_ref": "morgen",
          "field": "title",
          "digest": "sha256:ce749a88aa9016f84c6d4bb7df41c8061a089d3cde10376e38dd08db8567441e"
        },
        {
          "slot": "items",
          "record_ref": "morgen",
          "field": "body",
          "digest": "sha256:35b83ff2de28c602e2de97d3c9032a3634948291604ecc1c326ec0bfb32dccc9"
        }
      ],
      "source_refs": [
        "fraunhofer-2025",
        "vdma-2025"
      ]
    },
    {
      "id": "u-komponenten",
      "role": "supporting-group",
      "pattern": "sourced-chart",
      "variant": "bar",
      "bindings": [
        {
          "slot": "claim",
          "record_ref": "komponenten",
          "field": "title",
          "digest": "sha256:3f8ee606ba62285f1c2834dc7e4e3a64d37af690bb7f7e22f6b552bb7ab50503"
        },
        {
          "slot": "context",
          "record_ref": "komponenten",
          "field": "body",
          "digest": "sha256:a96156bce140b769b947db852118888b70018743b10d7a0d13d15efd824e607a"
        }
      ],
      "data_bindings": [
        {
          "slot": "series",
          "data_ref": "stillstand"
        },
        {
          "slot": "series",
          "data_ref": "lohnaufschlag"
        },
        {
          "slot": "series",
          "data_ref": "versicherung"
        },
        {
          "slot": "series",
          "data_ref": "nachruestung"
        }
      ],
      "source_refs": [
        "fraunhofer-2025",
        "destatis-2030",
        "handelsblatt-2026",
        "vdma-2025"
      ]
    },
    {
      "id": "u-bausteine",
      "role": "system",
      "pattern": "conceptual-system",
      "variant": "cluster",
      "bindings": [
        {
          "slot": "claim",
          "record_ref": "bausteine",
          "field": "title",
          "digest": "sha256:155117dd0169f32b2b9077cf26ea041ed1bc89a4d36e4ecc44af297e716c90da"
        },
        {
          "slot": "entities",
          "record_ref": "bausteine",
          "field": "body",
          "digest": "sha256:118918040e8385c38c7bee63b83d1ee31d20f5e912ba6579aefb62db55249ec2"
        },
        {
          "slot": "entities",
          "record_ref": "bausteine-2",
          "field": "title",
          "digest": "sha256:d540ac8769b7e03a3f0625de5fd8e4860bf8d787fd7423d22db0aea0d3eeaa70"
        },
        {
          "slot": "entities",
          "record_ref": "bausteine-2",
          "field": "body",
          "digest": "sha256:6d70357e4cede833bd1a4a9831e5386eb06628864cb5fbcfa0ea58b9bbf3bdc2"
        }
      ],
      "entities": [
        {
          "id": "e1",
          "record_ref": "bausteine",
          "field": "body"
        },
        {
          "id": "e2",
          "record_ref": "bausteine-2",
          "field": "title"
        },
        {
          "id": "e3",
          "record_ref": "bausteine-2",
          "field": "body"
        }
      ],
      "relationships": [
        {
          "from": "e2",
          "to": "e1",
          "kind": "depends-on"
        },
        {
          "from": "e3",
          "to": "e2",
          "kind": "enables"
        }
      ],
      "source_refs": [
        "vdma-2025"
      ]
    },
    {
      "id": "u-quellen",
      "role": "source-register",
      "pattern": "sources",
      "variant": "register",
      "bindings": [],
      "source_refs": [],
      "register_refs": [
        "fraunhofer-2025",
        "destatis-2030",
        "handelsblatt-2026",
        "vdma-2025"
      ]
    }
  ],
  "document_bindings": []
}
